{
  "version": 1,
  "generatedFrom": "feature/plugin-mossx-0.8.9 working tree",
  "notes": "Wave 0A inventory. Product code stays. retired-unreferenced is empty. Soft later-plugin imports do not fail CI yet.",
  "owners": [
    {
      "id": "frontend.about",
      "layer": "frontend",
      "path": "src/features/about",
      "ownerClass": "later-plugin",
      "targetPluginId": "com.mossx.about",
      "commands": [],
      "stores": [],
      "dataPaths": [],
      "deleteGate": "after-pilot-disable",
      "notes": "Default later-plugin until a dedicated Wave reclassifies it"
    },
    {
      "id": "frontend.agent-catalog",
      "layer": "frontend",
      "path": "src/features/agent-catalog",
      "ownerClass": "later-plugin",
      "targetPluginId": "com.mossx.agent-catalog",
      "commands": [],
      "stores": [],
      "dataPaths": [],
      "deleteGate": "after-pilot-disable",
      "notes": "Stay in tree until its own Wave"
    },
    {
      "id": "frontend.app",
      "layer": "frontend",
      "path": "src/features/app",
      "ownerClass": "core",
      "targetPluginId": null,
      "commands": [],
      "stores": [],
      "dataPaths": [],
      "deleteGate": "never",
      "notes": "Core product foundation"
    },
    {
      "id": "frontend.browser-agent",
      "layer": "frontend",
      "path": "src/features/browser-agent",
      "ownerClass": "later-plugin",
      "targetPluginId": "com.mossx.browser",
      "commands": [],
      "stores": [],
      "dataPaths": [],
      "deleteGate": "after-pilot-disable",
      "notes": "Stay in tree until its own Wave"
    },
    {
      "id": "frontend.client-documentation",
      "layer": "frontend",
      "path": "src/features/client-documentation",
      "ownerClass": "later-plugin",
      "targetPluginId": "com.mossx.client-documentation",
      "commands": [],
      "stores": [],
      "dataPaths": [],
      "deleteGate": "after-pilot-disable",
      "notes": "Default later-plugin until a dedicated Wave reclassifies it"
    },
    {
      "id": "frontend.client-ui-visibility",
      "layer": "frontend",
      "path": "src/features/client-ui-visibility",
      "ownerClass": "later-plugin",
      "targetPluginId": "com.mossx.client-ui-visibility",
      "commands": [],
      "stores": [],
      "dataPaths": [],
      "deleteGate": "after-pilot-disable",
      "notes": "Default later-plugin until a dedicated Wave reclassifies it"
    },
    {
      "id": "frontend.code-annotations",
      "layer": "frontend",
      "path": "src/features/code-annotations",
      "ownerClass": "later-plugin",
      "targetPluginId": "com.mossx.code-annotations",
      "commands": [],
      "stores": [],
      "dataPaths": [],
      "deleteGate": "after-pilot-disable",
      "notes": "Default later-plugin until a dedicated Wave reclassifies it"
    },
    {
      "id": "frontend.codex",
      "layer": "frontend",
      "path": "src/features/codex",
      "ownerClass": "later-plugin",
      "targetPluginId": "com.mossx.engine.codex",
      "commands": [],
      "stores": [],
      "dataPaths": [],
      "deleteGate": "after-pilot-disable",
      "notes": "Stay in tree until its own Wave"
    },
    {
      "id": "frontend.collaboration",
      "layer": "frontend",
      "path": "src/features/collaboration",
      "ownerClass": "later-plugin",
      "targetPluginId": "com.mossx.collaboration",
      "commands": [],
      "stores": [],
      "dataPaths": [],
      "deleteGate": "after-pilot-disable",
      "notes": "Stay in tree until its own Wave"
    },
    {
      "id": "frontend.commands",
      "layer": "frontend",
      "path": "src/features/commands",
      "ownerClass": "later-plugin",
      "targetPluginId": "com.mossx.commands",
      "commands": [],
      "stores": [],
      "dataPaths": [],
      "deleteGate": "after-pilot-disable",
      "notes": "Default later-plugin until a dedicated Wave reclassifies it"
    },
    {
      "id": "frontend.commons",
      "layer": "frontend",
      "path": "src/features/commons",
      "ownerClass": "core",
      "targetPluginId": null,
      "commands": [],
      "stores": [],
      "dataPaths": [],
      "deleteGate": "never",
      "notes": "Core product foundation"
    },
    {
      "id": "frontend.composer",
      "layer": "frontend",
      "path": "src/features/composer",
      "ownerClass": "core",
      "targetPluginId": null,
      "commands": [],
      "stores": [],
      "dataPaths": [],
      "deleteGate": "never",
      "notes": "Core product foundation"
    },
    {
      "id": "frontend.computer-use",
      "layer": "frontend",
      "path": "src/features/computer-use",
      "ownerClass": "later-plugin",
      "targetPluginId": "com.mossx.computer-use",
      "commands": [],
      "stores": [],
      "dataPaths": [],
      "deleteGate": "after-pilot-disable",
      "notes": "Stay in tree until its own Wave"
    },
    {
      "id": "frontend.context-ledger",
      "layer": "frontend",
      "path": "src/features/context-ledger",
      "ownerClass": "later-plugin",
      "targetPluginId": "com.mossx.context-ledger",
      "commands": [],
      "stores": [],
      "dataPaths": [],
      "deleteGate": "after-pilot-disable",
      "notes": "Default later-plugin until a dedicated Wave reclassifies it"
    },
    {
      "id": "frontend.curated-skills",
      "layer": "frontend",
      "path": "src/features/curated-skills",
      "ownerClass": "later-plugin",
      "targetPluginId": "com.mossx.skills",
      "commands": [],
      "stores": [],
      "dataPaths": [],
      "deleteGate": "after-pilot-disable",
      "notes": "Stay in tree until its own Wave"
    },
    {
      "id": "frontend.debug",
      "layer": "frontend",
      "path": "src/features/debug",
      "ownerClass": "later-plugin",
      "targetPluginId": "com.mossx.debug",
      "commands": [],
      "stores": [],
      "dataPaths": [],
      "deleteGate": "after-pilot-disable",
      "notes": "Default later-plugin until a dedicated Wave reclassifies it"
    },
    {
      "id": "frontend.dictation",
      "layer": "frontend",
      "path": "src/features/dictation",
      "ownerClass": "later-plugin",
      "targetPluginId": "com.mossx.dictation",
      "commands": [],
      "stores": [],
      "dataPaths": [],
      "deleteGate": "after-pilot-disable",
      "notes": "Stay in tree until its own Wave"
    },
    {
      "id": "frontend.engine",
      "layer": "frontend",
      "path": "src/features/engine",
      "ownerClass": "core",
      "targetPluginId": null,
      "commands": [],
      "stores": [],
      "dataPaths": [],
      "deleteGate": "never",
      "notes": "Core product foundation"
    },
    {
      "id": "frontend.engine-task-output",
      "layer": "frontend",
      "path": "src/features/engine-task-output",
      "ownerClass": "core",
      "targetPluginId": null,
      "commands": [],
      "stores": [],
      "dataPaths": [],
      "deleteGate": "never",
      "notes": "Core product foundation"
    },
    {
      "id": "frontend.extensions",
      "layer": "frontend",
      "path": "src/features/extensions",
      "ownerClass": "core",
      "targetPluginId": null,
      "commands": [],
      "stores": [],
      "dataPaths": [],
      "deleteGate": "never",
      "notes": "Core product foundation"
    },
    {
      "id": "frontend.files",
      "layer": "frontend",
      "path": "src/features/files",
      "ownerClass": "core",
      "targetPluginId": null,
      "commands": [],
      "stores": [],
      "dataPaths": [],
      "deleteGate": "never",
      "notes": "Core product foundation"
    },
    {
      "id": "frontend.git",
      "layer": "frontend",
      "path": "src/features/git",
      "ownerClass": "core",
      "targetPluginId": null,
      "commands": [],
      "stores": [],
      "dataPaths": [],
      "deleteGate": "never",
      "notes": "Core product foundation"
    },
    {
      "id": "frontend.git-history",
      "layer": "frontend",
      "path": "src/features/git-history",
      "ownerClass": "later-plugin",
      "targetPluginId": "com.mossx.git-history",
      "commands": [],
      "stores": [],
      "dataPaths": [],
      "deleteGate": "after-pilot-disable",
      "notes": "Stay in tree until its own Wave"
    },
    {
      "id": "frontend.governance",
      "layer": "frontend",
      "path": "src/features/governance",
      "ownerClass": "later-plugin",
      "targetPluginId": "com.mossx.governance",
      "commands": [],
      "stores": [],
      "dataPaths": [],
      "deleteGate": "after-pilot-disable",
      "notes": "Default later-plugin until a dedicated Wave reclassifies it"
    },
    {
      "id": "frontend.home",
      "layer": "frontend",
      "path": "src/features/home",
      "ownerClass": "core",
      "targetPluginId": null,
      "commands": [],
      "stores": [],
      "dataPaths": [],
      "deleteGate": "never",
      "notes": "Core product foundation"
    },
    {
      "id": "frontend.intent-canvas",
      "layer": "frontend",
      "path": "src/features/intent-canvas",
      "ownerClass": "later-plugin",
      "targetPluginId": "com.mossx.intent-canvas",
      "commands": [],
      "stores": [],
      "dataPaths": [],
      "deleteGate": "after-pilot-disable",
      "notes": "Stay in tree until its own Wave"
    },
    {
      "id": "frontend.kanban",
      "layer": "frontend",
      "path": "src/features/kanban",
      "ownerClass": "later-plugin",
      "targetPluginId": "com.mossx.kanban",
      "commands": [],
      "stores": [],
      "dataPaths": [],
      "deleteGate": "after-pilot-disable",
      "notes": "Stay in tree until its own Wave"
    },
    {
      "id": "frontend.layout",
      "layer": "frontend",
      "path": "src/features/layout",
      "ownerClass": "core",
      "targetPluginId": null,
      "commands": [],
      "stores": [],
      "dataPaths": [],
      "deleteGate": "never",
      "notes": "Core product foundation"
    },
    {